{
  "schema_version": "bar_time_contract.v1",
  "contract_id": "lo2cin4bt.bar_time_contract.v1",
  "session_model": {
    "calendar_id": "XNYS",
    "timezone": "America/New_York",
    "session_scope": "regular",
    "session_label_policy": "exchange_local_date",
    "non_session_bar_policy": "reject"
  },
  "timestamp_model": {
    "time_standard": "UTC",
    "precision": "nanosecond",
    "clock": "historical_available_time",
    "ordering": "available_time_then_event_time_then_external_execution_sequence_then_lifecycle_stage_then_stream_id_then_source_sequence"
  },
  "price_model": {
    "price_basis": "split_dividend_adjusted",
    "corporate_action_policy": "provider_applied"
  },
  "streams": [
    {
      "stream_id": "execution_daily",
      "role": "execution",
      "source": {
        "kind": "external",
        "provider_id": "fixture_daily_direct"
      },
      "bar_spec": {
        "aggregation": "time",
        "step": 1,
        "unit": "day",
        "price_type": "last",
        "alignment": "session_open"
      },
      "timestamp_semantics": {
        "timestamp_convention": "bar_close",
        "interval_boundary": "left_open_right_closed",
        "bar_open_time_column": "bar_open_timestamp",
        "bar_close_time_column": "bar_close_timestamp",
        "available_time_column": "available_timestamp",
        "session_label_column": "session_label",
        "availability_policy": "bar_close"
      }
    },
    {
      "stream_id": "decision_monthly",
      "role": "decision",
      "source": {
        "kind": "derived",
        "parent_stream_id": "execution_daily",
        "aggregation_engine": "shared_rust",
        "empty_bar_policy": "omit",
        "partial_first_bar_policy": "omit",
        "partial_final_bar_policy": "omit"
      },
      "bar_spec": {
        "aggregation": "time",
        "step": 1,
        "unit": "month",
        "price_type": "last",
        "alignment": "calendar_period_start"
      },
      "timestamp_semantics": {
        "timestamp_convention": "bar_close",
        "interval_boundary": "left_open_right_closed",
        "bar_open_time_column": "bar_open_timestamp",
        "bar_close_time_column": "bar_close_timestamp",
        "available_time_column": "available_timestamp",
        "session_label_column": "session_label",
        "availability_policy": "bar_close"
      }
    }
  ]
}
